competitor,category,value_proposition_real,top_strength_1,top_strength_2,top_strength_3,weakness_1,weakness_2,weakness_3,business_model,core_persona,avoids_intentionally,innovation_score_1_5,richness_score_1_5
Headspace,Wellness Content,"Trusted broad mindfulness/sleep library with strong brand","Large multi-format content library","Family plan value","Medical spending support (HSA/FSA annual)", "Cancellation/renewal friction complaints","Less real-time personalization","Outcome tracking mostly indirect","B2C subscription + family + B2B","General stressed adults seeking calm routine","Open-ended AI companion behavior",2,4
Calm,Wellness Content,"Simple daily calm/sleep utility for broad audience","Clear plan packaging","Strong sleep content positioning","Lifetime option attracts price-sensitive users","Billing/refund frustration signals","Audio/runtime glitches reported by users","Limited action-oriented guidance","B2C subscription + lifetime + B2B","Users prioritizing sleep/stress relief","Clinical-style interactive coaching",2,3
Wysa,AI Mental Health Support,"CBT-style AI self-help with optional coaching escalation","High app rating and trust","Structured CBT/DBT tools","Clear B2B team offering","Perceived repetition over long use","Can feel scripted for some users","Premium boundaries reduce depth for free users","Freemium + coaching + B2B seats","Users wanting guided self-help structure","Companion/relationship-first AI","4",4
Youper,AI Mood Tracking,"Safe AI journaling + mood tracking with guardrails","Strong app rating","Safety boundaries explicitly communicated","Simple chat + tracking flow","Perceived paywall/value tension","Less immediate execution coaching","Not positioned for crisis handling","Freemium subscription","Self-reflective users who track mood consistently","Relationship-style AI companionship",3,3
Replika,AI Companion,"Persistent emotional companion with deep personalization","High emotional engagement","Rich subscription tiering","Long-term companion retention loop","Pricing/tier confusion complaints","Strict refund limitations","Actionable behavior change often secondary","Freemium + multi-tier subscriptions","Users seeking companionship and continuity","Clinical-evidence-first positioning",5,5
Woebot,Clinical Conversational AI,"Evidence-oriented conversational support distributed via institutions","Clinical credibility","Clear privacy positioning","Payer/employer/provider distribution","Access-code gate limits direct access","Safety flag friction in some user reports","Consumer delight layer is lighter","B2B2C contracts","Members in payer/employer care pathways","Open consumer companion model",4,3
Pi,General AI Companion,"Natural-feeling conversational companion, mostly free","Strong voice-like conversational feel","Low barrier (free)","High emotional resonance in user feedback","Stability/consistency complaints","Monetization clarity unclear","Weak explicit action-execution loop","Free consumer AI (evolving)","Users wanting immediate empathetic conversation","Clinical protocols and structured intervention",5,2
